{
  "action_id": "ACT-297b1d8cbc0f77a35760",
  "correlation_id": "J008:verify",
  "created_at": "2026-07-09T16:30:49.478225Z",
  "dispatch_id": "DSP-a2229e21cdd376ab636b",
  "job_id": "J008",
  "prompt": "Execute exactly one immutable dispatch using the command below.\nDo not begin any later workflow node.\nFirst run: python C:\\Projects\\BlackholeSim\\.agents\\skills\\job-orchestrator\\scripts\\workerctl.py inspect --dispatch \"C:\\Projects\\ai-skills\\skills\\job-orchestrator\\runs\\20260708-215102-implement-all-4-openspec-proposals-core-\\jobs\\J008\\dispatches\\DSP-a2229e21cdd376ab636b.json\" --nonce \"NONCE-4d9e278059943b73049d\" --session-id \"opencode-session-J008\" --current-node \"verify\"\nCheckpoint at every policy milestone with workerctl checkpoint, passing the same inspected dispatch, a phase, and one next action.\nWhen finished, run workerctl finalize with the same inspected dispatch and --session-id \"opencode-session-J008\", then return that validated result only.\n",
  "run_id": "20260708-215102-implement-all-4-openspec-proposals-core-",
  "schema_version": 3,
  "status": "unresolved",
  "type": "send_dispatch"
}
