{
  "action_id": "ACT-31e022b93e3dedb8e81e",
  "correlation_id": "J001:verify",
  "created_at": "2026-07-09T20:06:38.172438Z",
  "job_id": "J001",
  "prompt": "Worker subagent bootstrap payload. The root orchestrator must send this text to the job subagent; the root must not execute it.\nBootstrap only. Do not perform domain work.\nRead frozen protocol: C:\\Projects\\ai-skills\\skills\\job-orchestrator\\runs\\RUN-aedc20b26e218a582373\\protocol\\job-protocol.md\nRead contract: C:\\Projects\\ai-skills\\skills\\job-orchestrator\\runs\\RUN-aedc20b26e218a582373\\jobs\\J001\\contract.json\nRecovery checkpoint (if non-empty): C:\\Projects\\ai-skills\\skills\\job-orchestrator\\runs\\RUN-aedc20b26e218a582373\\jobs\\J001\\checkpoint.md\nCompleted work units: none\nExact next permitted action: acknowledge; do not resume domain work yet\nValidate both and emit the canonical acknowledgement with:\npython C:\\Projects\\BlackholeSim\\.agents\\skills\\job-orchestrator\\scripts\\workerctl.py acknowledge --contract \"C:\\Projects\\ai-skills\\skills\\job-orchestrator\\runs\\RUN-aedc20b26e218a582373\\jobs\\J001\\contract.json\" --protocol-version 3 --protocol-sha256 be41cdf4f05fc94d330f63b3d9139fe3254e912ab0d983d3b450850018c8486e --job-id \"J001\" --contract-revision 1 --current-node \"verify\"\nThe orchestrator records the authoritative transport session ID alongside this acknowledgement.\n",
  "response_hash": "8382c9b29c504db5355230d7e2279719d68d464ab56ce3582e78d8a4dc5917bc",
  "run_id": "RUN-aedc20b26e218a582373",
  "schema_version": 3,
  "status": "resolved",
  "type": "spawn_and_bootstrap"
}
