{
  "action_id": "ACT-4a04705b98e286143e9a",
  "correlation_id": "J003:verify",
  "created_at": "2026-07-09T20:47:19.561043Z",
  "dispatch_id": "DSP-7f419defaa51df022bac",
  "job_id": "J003",
  "prompt": "Worker subagent execution payload. The root orchestrator must send this text to the job subagent; the root must not execute it.\nExecute exactly one immutable dispatch using the command below.\nDo not begin any later workflow node.\nFirst run: python C:\\Projects\\BlackholeSim\\.agents\\skills\\job-orchestrator\\scripts\\workerctl.py inspect --dispatch \"C:\\Projects\\ai-skills\\skills\\job-orchestrator\\runs\\RUN-aedc20b26e218a582373\\jobs\\J003\\dispatches\\DSP-7f419defaa51df022bac.json\" --nonce \"NONCE-29a3bc1bd655d0df15d5\" --session-id \"ses_bootstrap_J003\" --current-node \"verify\"\nCheckpoint at every policy milestone with workerctl checkpoint, passing the same inspected dispatch, a phase, and one next action.\nWhen finished, run workerctl finalize with the same inspected dispatch and --session-id \"ses_bootstrap_J003\", then return that validated result only.\n",
  "response_hash": "0d3a5567c00b8e36a606b0229ca4ceab0a44d2beebe55a76b629dbff4ed32ff4",
  "run_id": "RUN-aedc20b26e218a582373",
  "schema_version": 3,
  "status": "resolved",
  "type": "send_dispatch"
}
