{
  "action_id": "ACT-24831c3cef7a7b83de19",
  "correlation_id": "J002:explore",
  "created_at": "2026-07-09T21:02:54.466789Z",
  "dispatch_id": "DSP-ea481266111bbb972a3f",
  "job_id": "J002",
  "prompt": "Worker subagent execution payload. The root orchestrator must send this text to the job subagent; the root must not execute it.\nExecute exactly one immutable dispatch using the command below.\nDo not begin any later workflow node.\nFirst run: python C:\\Projects\\BlackholeSim\\.agents\\skills\\job-orchestrator\\scripts\\workerctl.py inspect --dispatch \"C:\\Projects\\ai-skills\\skills\\job-orchestrator\\runs\\RUN-aedc20b26e218a582373\\jobs\\J002\\dispatches\\DSP-ea481266111bbb972a3f.json\" --nonce \"NONCE-c61db04342efeb4bda91\" --session-id \"ses_bootstrap_J002\" --current-node \"explore\"\nCheckpoint at every policy milestone with workerctl checkpoint, passing the same inspected dispatch, a phase, and one next action.\nWhen finished, run workerctl finalize with the same inspected dispatch and --session-id \"ses_bootstrap_J002\", then return that validated result only.\n",
  "response_hash": "4f65d05986d69ff10134f42711ce11657720796b8b83654589dc3195ea87f906",
  "run_id": "RUN-aedc20b26e218a582373",
  "schema_version": 3,
  "status": "resolved",
  "type": "send_dispatch"
}
