{
  "action_id": "ACT-f3ff0346ac0b66359550",
  "correlation_id": "J003:fix-findings",
  "created_at": "2026-07-09T20:51:49.889612Z",
  "dispatch_id": "DSP-606e7df8c30ccb4807f7",
  "job_id": "J003",
  "prompt": "Worker subagent execution payload. The root orchestrator must send this text to the job subagent; the root must not execute it.\nExecute exactly one immutable dispatch using the command below.\nDo not begin any later workflow node.\nFirst run: python C:\\Projects\\BlackholeSim\\.agents\\skills\\job-orchestrator\\scripts\\workerctl.py inspect --dispatch \"C:\\Projects\\ai-skills\\skills\\job-orchestrator\\runs\\RUN-aedc20b26e218a582373\\jobs\\J003\\dispatches\\DSP-606e7df8c30ccb4807f7.json\" --nonce \"NONCE-3b653e2fdbbbd907210d\" --session-id \"ses_bootstrap_J003\" --current-node \"fix-findings\"\nCheckpoint at every policy milestone with workerctl checkpoint, passing the same inspected dispatch, a phase, and one next action.\nWhen finished, run workerctl finalize with the same inspected dispatch and --session-id \"ses_bootstrap_J003\", then return that validated result only.\n",
  "response_hash": "ee35c89cdf2cf7713f3471404813917bf4e5e7f8058195982f9bb8d2d97eaed6",
  "run_id": "RUN-aedc20b26e218a582373",
  "schema_version": 3,
  "status": "resolved",
  "type": "send_dispatch"
}
