{
  "action_id": "ACT-c23113fffba20a2c20bf",
  "correlation_id": "J003:sync-specs",
  "created_at": "2026-07-09T20:54:22.592948Z",
  "dispatch_id": "DSP-8586679f8a2dcad036e1",
  "job_id": "J003",
  "prompt": "Worker subagent execution payload. The root orchestrator must send this text to the job subagent; the root must not execute it.\nExecute exactly one immutable dispatch using the command below.\nDo not begin any later workflow node.\nFirst run: python C:\\Projects\\BlackholeSim\\.agents\\skills\\job-orchestrator\\scripts\\workerctl.py inspect --dispatch \"C:\\Projects\\ai-skills\\skills\\job-orchestrator\\runs\\RUN-aedc20b26e218a582373\\jobs\\J003\\dispatches\\DSP-8586679f8a2dcad036e1.json\" --nonce \"NONCE-d8725ae4105a64ccacb7\" --session-id \"ses_bootstrap_J003\" --current-node \"sync-specs\"\nCheckpoint at every policy milestone with workerctl checkpoint, passing the same inspected dispatch, a phase, and one next action.\nWhen finished, run workerctl finalize with the same inspected dispatch and --session-id \"ses_bootstrap_J003\", then return that validated result only.\n",
  "response_hash": "d5104d5f745b0d492bd49f839ed7af9afd13bd34a891d39a45decc183f8308f0",
  "run_id": "RUN-aedc20b26e218a582373",
  "schema_version": 3,
  "status": "resolved",
  "type": "send_dispatch"
}
