{
  "action_id": "ACT-c2aebfad04ae420b4d13",
  "correlation_id": "20260708-215102-implement-all-4-openspec-proposals-core-",
  "created_at": "2026-07-09T17:07:36.478883Z",
  "job_id": null,
  "prompt": null,
  "run_id": "20260708-215102-implement-all-4-openspec-proposals-core-",
  "schema_version": 3,
  "status": "unresolved",
  "type": "wait"
}
