{
  "action_id": "ACT-e23490e59521f2f20c82",
  "correlation_id": "J008:apply",
  "created_at": "2026-07-09T15:04:57.764812Z",
  "job_id": "J008",
  "prompt": "Bootstrap only. Do not perform domain work.\nRead frozen protocol: C:\\Projects\\ai-skills\\skills\\job-orchestrator\\runs\\20260708-215102-implement-all-4-openspec-proposals-core-\\protocol\\job-protocol.md\nRead contract: C:\\Projects\\ai-skills\\skills\\job-orchestrator\\runs\\20260708-215102-implement-all-4-openspec-proposals-core-\\jobs\\J008\\contract.json\nRecovery checkpoint (if non-empty): C:\\Projects\\ai-skills\\skills\\job-orchestrator\\runs\\20260708-215102-implement-all-4-openspec-proposals-core-\\jobs\\J008\\checkpoint.md\nCompleted work units: none\nExact next permitted action: acknowledge; do not resume domain work yet\nValidate both and emit the canonical acknowledgement with:\npython C:\\Projects\\BlackholeSim\\.agents\\skills\\job-orchestrator\\scripts\\workerctl.py acknowledge --contract \"C:\\Projects\\ai-skills\\skills\\job-orchestrator\\runs\\20260708-215102-implement-all-4-openspec-proposals-core-\\jobs\\J008\\contract.json\" --protocol-version 3 --protocol-sha256 525bf5390a8baa9783cdfb6b486a642bf9c7658d195a450816ae9b27b59e13e4 --job-id \"J008\" --contract-revision 2 --current-node \"apply\"\nThe orchestrator records the authoritative transport session ID alongside this acknowledgement.\n",
  "response_hash": "ca3824baa596e2c01008104d1f79e3002b40f61ae34e935e50d3716bf9618d67",
  "run_id": "20260708-215102-implement-all-4-openspec-proposals-core-",
  "schema_version": 3,
  "status": "resolved",
  "type": "spawn_and_bootstrap"
}
